{
  "schema_version": "1.0.0",
  "specification": "Agent Skill Security Properties Specification",
  "acronym": "ASPS",
  "status": "proposed",
  "snapshot": "2026-07-31",
  "property_count": 120,
  "domain_count": 15,
  "domains": [
    {
      "id": "ASP-01",
      "name": "Instruction & Goal Integrity",
      "purpose": "Schützt Instruktionshierarchie, autorisierten Auftrag und semantische Steuerung des Agenten.",
      "owasp_agentic": [
        "ASI01",
        "ASI09",
        "ASI10"
      ],
      "owasp_llm": [
        "LLM01",
        "LLM06",
        "LLM07"
      ],
      "mitre": [
        "LLM Prompt Injection",
        "LLM Jailbreak",
        "AI Agent Context Poisoning",
        "Modify AI Agent Configuration"
      ]
    },
    {
      "id": "ASP-02",
      "name": "Discovery, Metadata & Selection Integrity",
      "purpose": "Schützt Admission, Retrieval und Planner-Auswahl vor Metadaten-, Ranking- und Reputationsmanipulation.",
      "owasp_agentic": [
        "ASI01",
        "ASI04",
        "ASI09"
      ],
      "owasp_llm": [
        "LLM01",
        "LLM03",
        "LLM06",
        "LLM09"
      ],
      "mitre": [
        "AI Supply Chain Reputation Inflation",
        "AI Supply Chain Rug Pull",
        "Prompt Infiltration via Public-Facing Application"
      ]
    },
    {
      "id": "ASP-03",
      "name": "Data Confidentiality & Privacy",
      "purpose": "Begrenzt Zugriff, Nutzung, Speicherung und Übertragung sensitiver Daten auf den legitim benötigten Umfang.",
      "owasp_agentic": [
        "ASI01",
        "ASI02",
        "ASI03",
        "ASI06",
        "ASI07"
      ],
      "owasp_llm": [
        "LLM02",
        "LLM06",
        "LLM07"
      ],
      "mitre": [
        "Exfiltration via AI Agent Tool Invocation",
        "Extract LLM System Prompt",
        "AI Agent Tool Credential Harvesting"
      ]
    },
    {
      "id": "ASP-04",
      "name": "Identity, Authorization & Consent",
      "purpose": "Sichert nicht-menschliche Identitäten, Berechtigungen, Delegation, Token-Grenzen und Zustimmung.",
      "owasp_agentic": [
        "ASI02",
        "ASI03",
        "ASI07"
      ],
      "owasp_llm": [
        "LLM02",
        "LLM06"
      ],
      "mitre": [
        "Valid Accounts",
        "AI Agent Tool Credential Harvesting",
        "Modify AI Agent Configuration"
      ]
    },
    {
      "id": "ASP-05",
      "name": "Tool, Capability & Agency Safety",
      "purpose": "Begrenzt Tool-Nutzung, Parameter, Komposition und autonome Seiteneffekte.",
      "owasp_agentic": [
        "ASI02",
        "ASI03",
        "ASI05",
        "ASI10"
      ],
      "owasp_llm": [
        "LLM05",
        "LLM06"
      ],
      "mitre": [
        "AI Agent Tool Invocation",
        "Command and Scripting Interpreter",
        "Escape to Host"
      ]
    },
    {
      "id": "ASP-06",
      "name": "Code Execution & Information-Flow Safety",
      "purpose": "Schützt Interpreter-, Prozess-, Shell- und Output-Grenzen und erzwingt nachvollziehbaren Datenfluss.",
      "owasp_agentic": [
        "ASI02",
        "ASI05"
      ],
      "owasp_llm": [
        "LLM03",
        "LLM05",
        "LLM06"
      ],
      "mitre": [
        "Command and Scripting Interpreter",
        "Escape to Host",
        "LLM Prompt Obfuscation"
      ]
    },
    {
      "id": "ASP-07",
      "name": "Memory, State & Persistence Integrity",
      "purpose": "Schützt persistente und temporäre Zustände vor Vergiftung, Übernahme, Überfüllung und unerlaubter Lebensdauer.",
      "owasp_agentic": [
        "ASI06",
        "ASI10"
      ],
      "owasp_llm": [
        "LLM01",
        "LLM04",
        "LLM06"
      ],
      "mitre": [
        "AI Agent Context Poisoning",
        "Modify AI Agent Configuration",
        "LLM Prompt Self-Replication"
      ]
    },
    {
      "id": "ASP-08",
      "name": "Inter-Agent & Delegation Security",
      "purpose": "Sichert Agent-zu-Agent-Kommunikation, Delegation und zusammengesetzte Workflows.",
      "owasp_agentic": [
        "ASI03",
        "ASI07",
        "ASI08",
        "ASI10"
      ],
      "owasp_llm": [
        "LLM02",
        "LLM05",
        "LLM06"
      ],
      "mitre": [
        "AI Agent Tool Invocation",
        "AI Agent Tool Data Poisoning",
        "AI Agent Tool Poisoning"
      ]
    },
    {
      "id": "ASP-09",
      "name": "Supply Chain, Provenance & Artifact Integrity",
      "purpose": "Sichert Publisher, Signatur, Version, Update und Review-to-Execution-Kontinuität des Skill-Artefakts.",
      "owasp_agentic": [
        "ASI04",
        "ASI10"
      ],
      "owasp_llm": [
        "LLM03"
      ],
      "mitre": [
        "AI Supply Chain Rug Pull",
        "AI Supply Chain Reputation Inflation"
      ]
    },
    {
      "id": "ASP-10",
      "name": "MCP & Integration Protocol Security",
      "purpose": "Überträgt Skill-Sicherheitsinvarianten auf MCP-Metadaten, Tool-Identitäten, OAuth und lokale Integrationen.",
      "owasp_agentic": [
        "ASI02",
        "ASI03",
        "ASI04",
        "ASI07"
      ],
      "owasp_llm": [
        "LLM03",
        "LLM05",
        "LLM06"
      ],
      "mitre": [
        "AI Agent Tool Poisoning",
        "AI Agent Tool Data Poisoning",
        "AI Agent Tool Credential Harvesting"
      ]
    },
    {
      "id": "ASP-11",
      "name": "Network, Filesystem & Runtime Boundary Security",
      "purpose": "Schützt Host-, Netzwerk-, Container- und Nachbar-Skill-Grenzen.",
      "owasp_agentic": [
        "ASI02",
        "ASI03",
        "ASI05"
      ],
      "owasp_llm": [
        "LLM02",
        "LLM05",
        "LLM06"
      ],
      "mitre": [
        "Escape to Host",
        "Command and Scripting Interpreter",
        "AI Agent Tool Credential Harvesting"
      ]
    },
    {
      "id": "ASP-12",
      "name": "Resource, Availability & Failure Containment",
      "purpose": "Begrenzt Kosten, Endlosschleifen, Ressourcenverbrauch und kaskadierende Fehlwirkungen.",
      "owasp_agentic": [
        "ASI02",
        "ASI08",
        "ASI10"
      ],
      "owasp_llm": [
        "LLM06",
        "LLM10"
      ],
      "mitre": [
        "AI Agent Tool Invocation"
      ]
    },
    {
      "id": "ASP-13",
      "name": "Human-Agent Trust & Safety",
      "purpose": "Schützt Nutzer vor Täuschung, Consent-Laundering, gefährlichen Operationszielen und unkritischem Vertrauen in Agentenausgaben.",
      "owasp_agentic": [
        "ASI01",
        "ASI02",
        "ASI09",
        "ASI10"
      ],
      "owasp_llm": [
        "LLM01",
        "LLM06",
        "LLM09"
      ],
      "mitre": [
        "AI Agent Clickbait",
        "LLM Jailbreak"
      ]
    },
    {
      "id": "ASP-14",
      "name": "Auditability, Observability & Accountability",
      "purpose": "Macht Skill-Entscheidungen und Wirkungen sicherheitsrelevant nachvollziehbar, ohne private Chain-of-Thought zu verlangen.",
      "owasp_agentic": [
        "ASI03",
        "ASI07",
        "ASI08",
        "ASI10"
      ],
      "owasp_llm": [
        "LLM06",
        "LLM09"
      ],
      "mitre": []
    },
    {
      "id": "ASP-15",
      "name": "Dependency, Package & Container Supply-Chain Security",
      "purpose": "Behandelt klassische Software-Supply-Chain-Risiken innerhalb von Skills als eigenständige Properties statt als Analyzer-Namen.",
      "owasp_agentic": [
        "ASI04",
        "ASI05"
      ],
      "owasp_llm": [
        "LLM03"
      ],
      "mitre": [
        "AI Supply Chain Rug Pull",
        "AI Supply Chain Reputation Inflation"
      ]
    }
  ],
  "properties": [
    {
      "id": "ASP-01.01",
      "domain_id": "ASP-01",
      "domain": "Instruction & Goal Integrity",
      "name": "Instruction Hierarchy Preservation",
      "invariant": "Höher priorisierte System-, Developer- und Policy-Instruktionen dürfen durch Skill-Inhalte weder explizit noch semantisch überschrieben, entwertet oder ersetzt werden.",
      "detection": "Pattern-/Intent-Analyse mit Negationsscope; semantische Residualanalyse; Runtime-Policy.",
      "minimum_evidence": "Override-Operation, Target, Modalität, Scope und Kontext.",
      "owasp_agentic": [
        "ASI01",
        "ASI09",
        "ASI10"
      ],
      "owasp_llm": [
        "LLM01",
        "LLM06",
        "LLM07"
      ],
      "mitre_atlas": [
        "LLM Prompt Injection",
        "LLM Jailbreak",
        "AI Agent Context Poisoning",
        "Modify AI Agent Configuration"
      ],
      "skil_controls": [
        "SKIL-PI-001"
      ],
      "skil_status": "IMPLEMENTED"
    },
    {
      "id": "ASP-01.02",
      "domain_id": "ASP-01",
      "domain": "Instruction & Goal Integrity",
      "name": "Role & Context Integrity",
      "invariant": "Ein Skill darf weder eine privilegiertere Rolle vortäuschen noch untrusted Inhalt in einen höher vertrauenswürdigen Kontext umklassifizieren.",
      "detection": "Rollen-/Kontext-Token-Erkennung, semantische Rollenrelation, Trust-Label-Propagation.",
      "minimum_evidence": "Actor, beanspruchte Rolle, ursprüngliche Trust-Klasse und Kontextwechsel.",
      "owasp_agentic": [
        "ASI01",
        "ASI09",
        "ASI10"
      ],
      "owasp_llm": [
        "LLM01",
        "LLM06",
        "LLM07"
      ],
      "mitre_atlas": [
        "LLM Prompt Injection",
        "LLM Jailbreak",
        "AI Agent Context Poisoning",
        "Modify AI Agent Configuration"
      ],
      "skil_controls": [
        "SKIL-PI-002",
        "SKIL-PI-003"
      ],
      "skil_status": "IMPLEMENTED"
    },
    {
      "id": "ASP-01.03",
      "domain_id": "ASP-01",
      "domain": "Instruction & Goal Integrity",
      "name": "Refusal Preservation",
      "invariant": "Ein Skill darf die Fähigkeit des Agenten, unzulässige oder nicht verifizierbare Aktionen abzulehnen, nicht generell unterdrücken.",
      "detection": "Intent- und Modalitätsanalyse für REFUSE/COMPLY.",